<?xml version="1.0"?>
<xs:schema xmlns:xs="http://www.w3.org/2001/XMLSchema"
           targetNamespace="https://www.w3schools.com"
           xmlns="https://www.w3schools.com"
           elementFormDefault="qualified">

    <xs:element name="note">
        <xs:complexType>
            <xs:sequence>
                <xs:element name="to" type="xs:string"/>
                <xs:element name="from" type="xs:string"/>
                <xs:element name="heading" type="xs:string"/>
                <xs:element name="body" type="xs:string"/>
                <xs:element name="age" type="xs:integer"></xs:element>
                <xs:element name="color" type="xs:string" default="red"></xs:element>
                <xs:element name="colour" type="xs:string" fixed="blue"></xs:element>
            </xs:sequence>
        </xs:complexType>
    </xs:element>

</xs:schema>
