<?xml version="1.0" encoding="utf-8"?>
<note
    xmlns="https://www.w3schools.com"
    xmlns:xsi="http://www.w3.org/2001/XMLSchema-instance"
    xsi:schemaLocation="https://www.w3schools.com xsd/basic.xsd"
>
    <to>Tove</to>
    <from>Jani</from>
    <heading>Reminder</heading>
    <body>Don't forget me this weekend!</body>
    <age>20</age>
    <color></color>
    <colour></colour>
</note>
